objectid,parentid,title,time_period,date,creator,category,description,significance,source,subject,location,state,latitude,longitude,cataloger,original_link,type,format,display_template,filename,object_location,image_small,image_thumb,image_alt_text,featured_image_id,essay_file
ipnw-objects-0066,ipnw-0014,The Great 1910 Fire of Idaho & Montana,,2010,"U.S. Forest Service, Northern Region",Map,"A map illustrating the extent of the 1910 ""Big Blowup"" wildfires across northern Idaho and western Montana.","The Great Fire of 1910 burned over three million acres and killed at least 85 people. It established the U.S. Forest Service's primary mission as one of aggressive fire suppression, a policy that shaped federal land management for a century. The disaster also directly led to the passage of the 1911 Weeks Act, pushing federal-state cooperation in fire protection.",U.S. Forest Service,Wildfires; Forest fires; U.S. Forest Service; 1910 Fire,Idaho Panhandle National Forests; Lolo National Forest; Coeur d'Alene National Forest; Wallace; Avery,Idaho; Montana,47.47238422,-115.9258811,Wade Wade,https://wildfiretoday.com/wp-content/uploads/2010/03/1910_fires_map.jpg,Image;StillImage,image/jpeg,image,ipnw-objects-0066.jpg,https://objects.lib.uidaho.edu/peoples-ipnw/ipnw-objects-0066.jpg,https://objects.lib.uidaho.edu/peoples-ipnw/small/ipnw-objects-0066_sm.jpg,https://objects.lib.uidaho.edu/peoples-ipnw/thumbs/ipnw-objects-0066_th.jpg,,,
ipnw-objects-0067,ipnw-0014,FOREST BURNED IN 1910 HOLOCAUST,,,U.S. Forest Service,Historic Image,"A map produced by the U.S. Forest Service shortly after the 1910 fires, illustrating the massive acreage burned.","Map produced by the U.S. Forest Service shortly after the 1910 fires, illustrating the massive acreage burned.",Had to use the wayback machine on the National Forest Website.,Wildfires; Forest fires; 1910 Fire; U.S. Forest Service,Wallace; Coeur d'Alene; Sandpoint; Libby; Missoula; Glacier National Park,Idaho; Montana; Washington,47.47238422,-115.92588111064025,Wade Wade,https://web.archive.org/web/20150617140734/http:/www.fs.usda.gov/detail/r1/learning/history-culture/?cid=stelprdb5122874,Image;StillImage,image/jpeg,image,ipnw-objects-0067.jpg,https://objects.lib.uidaho.edu/peoples-ipnw/ipnw-objects-0067.jpg,https://objects.lib.uidaho.edu/peoples-ipnw/small/ipnw-objects-0067_sm.jpg,https://objects.lib.uidaho.edu/peoples-ipnw/thumbs/ipnw-objects-0067_th.jpg,,,
ipnw-objects-0068,ipnw-0014,"Forest Fire Aftermath, 1910 - Wallace, elevated view of town [02]",,1910-08,Barnard-Stockbridge Studio,Historic Image,"Aerial photo taken from the tank of the town after the forest fire of August 20, 1910.","This photograph documents the aftermath of the 1910 Big Burn on Wallace, Idaho, showing how the fire destroyed nearly a third of the town.","University of Idaho Special Collections, The Big Burn Collection",fires; water tanks; towns,Wallace,Idaho,47.47238422,-115.9258811,Wade Wade,https://www.lib.uidaho.edu/digital/bigburn/items/bigburn15.html,,image/jpeg,image,bigburn15.jpg,https://objects.lib.uidaho.edu/bigburn/bigburn15.jpg,https://objects.lib.uidaho.edu/bigburn/small/bigburn15_sm.jpg,https://objects.lib.uidaho.edu/bigburn/thumbs/bigburn15_th.jpg,,,
ipnw-objects-0071,ipnw-0015,Majestic snow cap of Mt Rainier Mt Rainier National Park Washington,,1922,Keystone View Company,Historic Image,Black-and-white stereograph print of the snow capped summit of Mount Rainier showing three men at the far base of the mountain.,This stereograph represents early twentieth century mountain photography and the growing popularity of mountaineering in Washington. It was distributed internationally by the Keystone View Company. It shows that Mount Rainier's image circulated to promote American natural beauty.,Library of Congress Prints and Photographs Division,Mount Rainier; mountaineering; national park scenery,Mount Rainier National Park; Washington,Washington,46.8523,-121.7603,Blake Moore,https://www.loc.gov/resource/cph.3a48795/,Image;StillImage,image/jpeg,image,ipnw-objects-0071.jpg,https://objects.lib.uidaho.edu/peoples-ipnw/ipnw-objects-0071.jpg,https://objects.lib.uidaho.edu/peoples-ipnw/small/ipnw-objects-0071_sm.jpg,https://objects.lib.uidaho.edu/peoples-ipnw/thumbs/ipnw-objects-0071_th.jpg,,,
ipnw-objects-0072,ipnw-0015,Art as in Mount Heaven Mount Rainer,,,Aaron Reed,Contemporary Image,"A modern, contemporary photo of Mount Rainer. With Vibrant colors in every aspect of the photo from the blueish purple sky to the flower patch in the bottom third. With Mount Rainer front and center.","This image showcases the true beauty of Mount Rainer and the agriculture surrounding it. This high-resolution photo shows the quite art that nature can have when left untouched. The photograph can be seen as a visual comparison to other historic photos of Mount Rainier, showing the environmental change is has seen.",Aaron Reed Photography gallery Mt Rainier National Park,Mount Rainier; landscape photography; fine art; national parks,Mount Rainier National Park; Washington,Washington,46.8523,-121.7603,Blake Moore,https://www.aaronreedphotography.com/photo/heaven/,,image/jpeg,image,ipnw-objects-0072.jpg,https://objects.lib.uidaho.edu/peoples-ipnw/ipnw-objects-0072.jpg,https://objects.lib.uidaho.edu/peoples-ipnw/small/ipnw-objects-0072_sm.jpg,https://objects.lib.uidaho.edu/peoples-ipnw/thumbs/ipnw-objects-0072_th.jpg,,,
